{
  "evidence_status": "confirmed",
  "families": [
    "television-full",
    "phone-full",
    "television-steam",
    "television-sber",
    "aosp-full",
    "launcher-system"
  ],
  "family_count": 6,
  "product_runtime_evidence_status": "unknown",
  "production_safety_classification": "PROD_SAFE_OFFLINE_STATIC_ONLY",
  "risk_summary": {
    "R0": 33,
    "R1": 22
  },
  "scenario_catalog_count": 15,
  "scenario_count": 307,
  "schema_version": "task043-surface-registry-v1",
  "surface_count": 55,
  "surfaces": [
    {
      "applicable_families": [
        "television-full",
        "phone-full",
        "television-steam",
        "television-sber",
        "aosp-full"
      ],
      "category": "auth",
      "evidence_status": "hypothesis",
      "family_scope": "all app families",
      "primary_tasks": [
        "TASK-044",
        "TASK-045",
        "TASK-046",
        "TASK-047",
        "TASK-049",
        "TASK-051"
      ],
      "public_safe_description": "Authentication guard and post-auth entry",
      "risk": "R0",
      "runtime_oracle_category": "screen/state category; no raw credentials",
      "scenario_count": 3,
      "scenario_ids": [
        "QA-044-005",
        "QA-046-003",
        "QA-047-003"
      ],
      "surface_id": "SURF-AUTH-001"
    },
    {
      "applicable_families": [
        "television-full",
        "phone-full",
        "television-steam",
        "television-sber",
        "aosp-full"
      ],
      "category": "session",
      "evidence_status": "hypothesis",
      "family_scope": "all app families",
      "primary_tasks": [
        "TASK-044",
        "TASK-046",
        "TASK-047",
        "TASK-050"
      ],
      "public_safe_description": "Session persistence and invalidation",
      "risk": "R0",
      "runtime_oracle_category": "observed auth/session state after lifecycle",
      "scenario_count": 2,
      "scenario_ids": [
        "QA-044-006",
        "QA-044-007"
      ],
      "surface_id": "SURF-AUTH-002"
    },
    {
      "applicable_families": [
        "television-full",
        "phone-full",
        "television-steam",
        "television-sber",
        "aosp-full"
      ],
      "category": "pair_auth",
      "evidence_status": "hypothesis",
      "family_scope": "TV+phone",
      "primary_tasks": [
        "TASK-045"
      ],
      "public_safe_description": "Cross-device same-account/session gating",
      "risk": "R0",
      "runtime_oracle_category": "paired success/denial state on both devices",
      "scenario_count": 1,
      "scenario_ids": [
        "QA-045-005"
      ],
      "surface_id": "SURF-AUTH-003"
    },
    {
      "applicable_families": [
        "television-full",
        "phone-full",
        "television-steam",
        "television-sber",
        "aosp-full"
      ],
      "category": "auth_edges",
      "evidence_status": "hypothesis",
      "family_scope": "applicable",
      "primary_tasks": [
        "TASK-044",
        "TASK-049",
        "TASK-051"
      ],
      "public_safe_description": "OTP/captcha/legal/error/retry boundaries",
      "risk": "R1",
      "runtime_oracle_category": "counter/error/recurrence state without mutation",
      "scenario_count": 1,
      "scenario_ids": [
        "QA-049-014"
      ],
      "surface_id": "SURF-AUTH-004"
    },
    {
      "applicable_families": [
        "television-full",
        "phone-full",
        "television-steam",
        "television-sber",
        "aosp-full"
      ],
      "category": "payment_session_boundary",
      "evidence_status": "hypothesis",
      "family_scope": "all applicable",
      "primary_tasks": [
        "TASK-044",
        "TASK-045",
        "TASK-046",
        "TASK-047",
        "TASK-049"
      ],
      "public_safe_description": "Payment or game-session safe stop",
      "risk": "R0",
      "runtime_oracle_category": "boundary evidence; no payment/start",
      "scenario_count": 5,
      "scenario_ids": [
        "QA-044-021",
        "QA-045-020",
        "QA-046-009",
        "QA-047-009",
        "QA-049-011"
      ],
      "surface_id": "SURF-BOUNDARY-001"
    },
    {
      "applicable_families": [
        "television-full",
        "phone-full",
        "television-steam",
        "television-sber",
        "aosp-full"
      ],
      "category": "qr_boundary",
      "evidence_status": "hypothesis",
      "family_scope": "all applicable",
      "primary_tasks": [
        "TASK-044",
        "TASK-049"
      ],
      "public_safe_description": "QR capture/decoding category and no traversal",
      "risk": "R1",
      "runtime_oracle_category": "local-only target; public category",
      "scenario_count": 2,
      "scenario_ids": [
        "QA-044-022",
        "QA-049-011"
      ],
      "surface_id": "SURF-BOUNDARY-002"
    },
    {
      "applicable_families": [
        "television-full",
        "television-steam",
        "television-sber",
        "aosp-full"
      ],
      "category": "catalog",
      "evidence_status": "hypothesis",
      "family_scope": "TV/STB",
      "primary_tasks": [
        "TASK-044",
        "TASK-046",
        "TASK-047",
        "TASK-049"
      ],
      "public_safe_description": "Actionable catalog readiness versus loader",
      "risk": "R0",
      "runtime_oracle_category": "actionable content/focus",
      "scenario_count": 5,
      "scenario_ids": [
        "QA-044-004",
        "QA-044-008",
        "QA-046-004",
        "QA-047-004",
        "QA-049-012"
      ],
      "surface_id": "SURF-CATALOG-001"
    },
    {
      "applicable_families": [
        "television-full",
        "television-steam",
        "television-sber",
        "aosp-full"
      ],
      "category": "catalog_lists",
      "evidence_status": "hypothesis",
      "family_scope": "TV/STB",
      "primary_tasks": [
        "TASK-044",
        "TASK-046",
        "TASK-047",
        "TASK-049"
      ],
      "public_safe_description": "Rails, grids, lazy loading and boundaries",
      "risk": "R1",
      "runtime_oracle_category": "focus/scroll/category sampling",
      "scenario_count": 3,
      "scenario_ids": [
        "QA-044-009",
        "QA-049-006",
        "QA-049-007"
      ],
      "surface_id": "SURF-CATALOG-002"
    },
    {
      "applicable_families": [
        "television-full",
        "television-steam",
        "television-sber",
        "aosp-full"
      ],
      "category": "device_equivalence",
      "evidence_status": "hypothesis",
      "family_scope": "TV/STB",
      "primary_tasks": [
        "TASK-042",
        "TASK-046",
        "TASK-047",
        "TASK-053"
      ],
      "public_safe_description": "TV/STB representative and equivalence devices",
      "risk": "R0",
      "runtime_oracle_category": "selected delta evidence",
      "scenario_count": 14,
      "scenario_ids": [
        "QA-042-010",
        "QA-042-011",
        "QA-042-013",
        "QA-042-014",
        "QA-042-016",
        "QA-046-014",
        "QA-047-014",
        "QA-053-001",
        "QA-053-002",
        "QA-053-003",
        "QA-053-004",
        "QA-053-009",
        "QA-053-010",
        "QA-053-015"
      ],
      "surface_id": "SURF-COMPAT-001"
    },
    {
      "applicable_families": [
        "television-full",
        "phone-full",
        "television-steam",
        "television-sber",
        "aosp-full",
        "launcher-system"
      ],
      "category": "os_oem",
      "evidence_status": "hypothesis",
      "family_scope": "all",
      "primary_tasks": [
        "TASK-046",
        "TASK-047",
        "TASK-053"
      ],
      "public_safe_description": "OS/OEM compatibility boundaries",
      "risk": "R1",
      "runtime_oracle_category": "risk-based selected results",
      "scenario_count": 7,
      "scenario_ids": [
        "QA-046-013",
        "QA-047-013",
        "QA-053-005",
        "QA-053-006",
        "QA-053-007",
        "QA-053-008",
        "QA-053-014"
      ],
      "surface_id": "SURF-COMPAT-002"
    },
    {
      "applicable_families": [
        "television-full",
        "television-steam",
        "television-sber",
        "aosp-full"
      ],
      "category": "game_detail",
      "evidence_status": "hypothesis",
      "family_scope": "TV/STB",
      "primary_tasks": [
        "TASK-044",
        "TASK-046",
        "TASK-047",
        "TASK-049"
      ],
      "public_safe_description": "Game card to detail transition",
      "risk": "R0",
      "runtime_oracle_category": "detail family and Back edge",
      "scenario_count": 4,
      "scenario_ids": [
        "QA-044-019",
        "QA-046-008",
        "QA-047-008",
        "QA-049-010"
      ],
      "surface_id": "SURF-DETAIL-001"
    },
    {
      "applicable_families": [
        "television-full",
        "television-steam",
        "television-sber",
        "aosp-full"
      ],
      "category": "server_list",
      "evidence_status": "hypothesis",
      "family_scope": "TV/STB",
      "primary_tasks": [
        "TASK-044",
        "TASK-046",
        "TASK-047",
        "TASK-049",
        "TASK-051"
      ],
      "public_safe_description": "Detail to server-list structure",
      "risk": "R0",
      "runtime_oracle_category": "dynamic structure without fixed rows",
      "scenario_count": 4,
      "scenario_ids": [
        "QA-044-020",
        "QA-046-008",
        "QA-047-008",
        "QA-049-010"
      ],
      "surface_id": "SURF-DETAIL-002"
    },
    {
      "applicable_families": [
        "television-full",
        "television-steam",
        "television-sber",
        "aosp-full",
        "launcher-system"
      ],
      "category": "focus",
      "evidence_status": "hypothesis",
      "family_scope": "TV/STB/system",
      "primary_tasks": [
        "TASK-044",
        "TASK-046",
        "TASK-047",
        "TASK-048",
        "TASK-049",
        "TASK-052",
        "TASK-054"
      ],
      "public_safe_description": "Visible focus acquisition and traversal",
      "risk": "R0",